### ISSUE TITLE
Interaction between cake-autorate and TCP

### ISSUE THREAD

**Issue by lynxthecat** [lynxthecat/cake-autorate#194]
It seems that under certain situations the cake bandwidth adjustments set by cake-autorate can result in direct TCP downloads to crawl to a halt. I believe this might be related to what is known as the 'Silly Window Syndrome':

https://en.wikipedia.org/wiki/Silly_window_syndrome. 

This is observable when downloading a sufficiently large file over a TCP connection and monitoring the transfer bandwidth. The transfer bandwidth sometimes creeps very low (e.g. mere bytes per second) and sticks there. During such very low bandwidth epochs, cake-autorate reports idle bandwidth, and clearly the available bandwidth is not being utilised. Manually pausing and restarting the download enables bandwidth recovery. 

Even if this is a problem with TCP, cake-autorate needs to try to work with the same. 

On my own connection, the only time I ever notice this phenomenon is with manually downloading files using the Chrome browser  - most recently updating my copy of the GNU Image Manipulation Program using this direct link here: 

https://download.gimp.org/gimp/v2.10/windows/gimp-2.10.34-setup.exe

Any thoughts on the above @moeller0 or @dtaht? Any suggestions for how to ameliorate?

**Comment by moeller0** [comment]
To see whether this is SWS we need a packet capture to get an idea about congestion/receive window size during the transfer. Cake itself can not do much here, sure you can set a higher minimum rate, but if your LTE link falls below that minimal rate sooner or later your LTE modem will drop packets and these can/will result in congestion window reduction....
If this is restricted to chrome a packet capture might be even more interesting to see what protocol it actually uses?

**Comment by lynxthecat** [comment]
@moeller0 so my minimum rates are both set to 5Mbit/s. If I turn cake off completely I don't see this phenomenon of dropping down to mere bytes per second. 

Here is a tcpdump snapshot during the tail end of a transfer that slowed down to just a few KB/s:

https://pastebin.com/raw/VaJ6AJzv

**Comment by moeller0** [comment]
I guess with an AQM on a rate step down (under load) there will be more drops than with a dumb FIFO. I can see how reasonably aggressive dropping might "help" getting the TCP connection into a hard to exit again state. (Not being able willing to climb up to decent rates, is on the TCP stacks involved, but getting them into the swamp in the first place seems partly cake's doing).
Question: do you have the ACK filter enabled? If yes, does this effect also show without ACK filter, if no does it show with ACK filter?

**Comment by lynxthecat** [comment]
No appreciable difference. Previous tcpdump sample was with ack-filter and now this one below is with no-ack-filter, and around the time download crept to just a few KB/s:

https://pastebin.com/raw/3ajsDULB

**Comment by moeller0** [comment]
> With dual-dsthost on download does this share out bandwidth between different sources (YouTube / .ISO download) directed to the same destination host? Could it be that I really need to use: triple-isolate to ensure that on my work machine bandwidth is shared evenly between different sources directed to my work machine?

dual-xxxhost will first arbitrate between active IP addresses (typically internal IP addresses) and within each IP's aggregate traffic it will treat flows equally. What can happen is that if on the TCP download host parallel to the download you have application open using many active flows in parallel that would throttle a single flow TCP download easily...

You can try triple-isolate instead, but IMHO if both work as expected it should not help...



> Network wise, everything works just fine: browsing, YouTube, Netflix, Amazon Prime, Teams, Zoom, etc.

Still annoying I guess?

**Comment by moeller0** [comment]
So triple-isolate is somewhat hard to predict in detail (this is why I prefer the dual-xxxhost modes, they are simpler to predict in detail*), but assuming the only shared IP addresses are of the end points (that is all flows have different remote IPs) and I assume lan1 and lan2 are IP addresses internal to your network and both want continuous capacity in excess of their equitable share (so they "saturate" their share).
dual-xxxhost: 
lan1 0.5X: each youtube flow and the ISO download flow 0.5X/6 = 0.083X
lan2 0.5X
(I did think that youtube videos only use a single stream though)
triple-isolate will be the same like dual-xxxhost unless the 5 youtube flows are served from the same IP address in which case it will get closer to what you predict... 

Now, Netflix and youtube traffic is quite bursty so the factors above are not going to be correct instance by instance but "on average" you can expect roughly that sharing behaviour.


*) For most traffic situations triple-isolate will come close to per internal IP fairness without needing information about direction, but for simple tests it can be harder to fully predict...

**Comment by moeller0** [comment]
Sidenote, the receive windows in the ACK packets seem pretty small. This might be part of your issue (in which case the receiving TCP stack has issues) or simply caused by tcpdump not reporting the TCP window scaling factor....
The receive window tells the sender how much data at max to put inflight...

**Comment by lynxthecat** [comment]
I just tried triple-isolate and it looks like it may help recovery from the very low bandwidth periods, but they still occur. 

Is the problem that cake-autorate is too rapidly cutting bandwidth during detected bufferbloat (when it uses the achieved rate as an estimate of bandwidth)?

**Comment by moeller0** [comment]
Not having looked deeply into the tcpdump traces (they are somewhat limited anyway ;) ) I think the culprit is likely the TCP stack, but I would guess the fact that autorate needs to pretty aggressively throttle the shaper does not help and sort of pushes the TCP flow out of the stack's comfort zone... 
I would record a tcpdump trace and look closer into it with wireshark....

**Comment by lynxthecat** [comment]
Could you recommend a tcpdump commandline to try and I will post link to upload?

**Comment by moeller0** [comment]
```
tcpdump -s 1600 -i pppoe-wan -w pppoe-wan_breitbandmessung.de.MTU1500.cap
```
`-s`: this will save up to 1600 bytes (so full packets including the data payload, if the payload is not relevant then `-s 100` or `-s 150` should suffice to capture the headers
`-i`: this is the interface to capture data from
`-w`: this is the name of the file to write, I typically first navigate to a directory on my router's attached harddisk/usb-stick that will accept the written data....

Not sure the controller can do much....

**Comment by lynxthecat** [comment]
I just e-mailed you a link to the data capture (given possible sensitive nature of some portions). 

Does it reveal anything helpful?

**Comment by moeller0** [comment]
Thanks, it is clear that the data transfer from canonical (91.189.91.123) is not going along smoothly and there are ship loads of duplicaye ACKs which indicate either lost or severely reordered packets... SACK (selective ACK) is enabled and should help fill holes but for some reason it does not seem terribly effective.... also the ACK traffic is marked CS0 while the data traffic is marked AF11.
The tcptrace graph for that download is pretty busy and looks overall terrible, but I am no tcptrace expert so might misinterpret things...

**Comment by lynxthecat** [comment]
No thank you for looking. 

I wonder what the significance of the markings are. These are what my ISP or upstream from my ISP set, right? I presume I should actually default all otherwise unclassified DSCPs to 0, correct? I believe upload ACKs would then get tagged as 0, and that then the corresponding download packets associated with the same tracked connections would get tagged as 0 on the restoration of DSCPs from conntrack, if this makes sense?

Aside from the DSCP issues, any thoughts on what I might try adjusting or changing to help compensate for this?

**Comment by moeller0** [comment]
You are using windows as client? Could you try with something else (like Linux or Android) just to check whether the problem seems specific to the TCP stack or whether it is generalized to all TCP?

**Comment by moeller0** [comment]
`     max retr time:           0.0 ms        max retr time:       27469.2 ms   `
this looks painful, 27 seconds for a retransmission... something is really off here...

**Comment by lynxthecat** [comment]
> You are using windows as client? Could you try with something else (like Linux or Android) just to check whether the problem seems specific to the TCP stack or whether it is generalized to all TCP?

From very brief and basic testing, I do not see the issue manifest when downloading the same file from my Apple iPad. 

With my windows laptop (or work machine), the issue manifests pretty rapidly. 

Could this be related:

https://learn.microsoft.com/en-us/troubleshoot/windows-server/networking/tcpip-performance-known-issues

**Comment by moeller0** [comment]
What do you get for:
```
netsh int tcp show global
```
it might help to enable ECN under windows, then cake might mostly mark instead of drop and the situation might look less bleak?

**Comment by moeller0** [comment]
"Is ECN enabled on Apple devices by default?"
That depends on the vintage of the apple OS, and apple uses some heuristics when to use and when not to use ECN. So in short: I do not know ;)

"So would you advise keeping the default receive window autotuning as set to 'normal'?"
No idea, I am not fluent enough in reading tcptrace output to decide whether the issue might be window related or not...

**Comment by lynxthecat** [comment]
This may be relevant: 

https://serverfault.com/questions/698504/receiver-limits-tcp-window-size-to-64-512

**Comment by lynxthecat** [comment]
If I set: 

```
netsh int tcp set global autotuninglevel=disabled
```

The download speed stays around 1MB/s in keeping with:

> In earlier versions of Windows, the Windows network stack used a fixed-size receive window (65,535 bytes) that limited the overall potential throughput for connections. The total achievable throughput of TCP connections could limit network usage scenarios. TCP receive window autotuning enables these scenarios to fully use the network.
> 
> For a TCP receive window that has a particular size, you can use the following equation to calculate the total throughput of a single connection.
> 
> Total achievable throughput in bytes = TCP receive window size in bytes * (1 / connection latency in seconds)

If I set:

```
netsh int tcp set global autotuninglevel=experimental
```

It then goes very high and climbs down to mere bytes per second.

**Comment by lynxthecat** [comment]
I tried enabling it, but it didn't seem to make any difference. I'm not sure if that's because it's not working though.

**Comment by moeller0** [comment]
That can be tested, by taking a packet capture, if ECN is used by cake you will see CE marks in some packets, you need to capture packets after cake had access to them...
That brings me to the question, where did you capture the data you sent me a link to:
canonical-server -> internet -> LTE-modem -> your OpenWrt router with cake -> your home network

I think to see download ECN activity the captures woulds need to be taken from "your home network"...

**Comment by lynxthecat** [comment]
canonical-server -> internet -> LTE-modem (yes Zyxel NR7101) -> your OpenWrt router with cake (yes RT3200) -> your home network (work machine connected via LAN cable to OpenWrt router)

**Comment by lynxthecat** [comment]
`tcpdump -i wwan0 -v "(tcp[13] & 0xc0 != 0)"` gives:

````
16:42:19.725555 IP (tos 0x2,ECT(0), ttl 64, id 50297, offset 0, flags [DF], proto TCP (6), length 48)
    xx.xx.xx.xx.50434 > fcix-mirror.ask4.net.443: Flags [SEW], cksum 0x81a5 (correct), seq 3036942751, win 64240, options [mss 1460,nop,nop,sackOK], length 0
```

**Comment by moeller0** [comment]
I would take a packet capture for that, or try something like (untested):
```
# ECN:
tcpdump -i pppoe-wan -v -n 'ip and (ip[1] & 0x3) == 0' # Not-ECT
tcpdump -i pppoe-wan -v -n 'ip and (ip[1] & 0x3) == 1' # ECT(1)
tcpdump -i pppoe-wan -v -n 'ip and (ip[1] & 0x3) == 2' # ECT(0)
tcpdump -i pppoe-wan -v -n 'ip and (ip[1] & 0x3) == 3' # CE
```

these seem to work for me, especially `tcpdump -i pppoe-wan -v -n 'ip and (ip[1] & 0x3) == 2' # ECT(0)` should trigger for packets that claim to support ECN by asserting ECT(0).
Sidenote: ECT(1) is currently rarely used and not worth bothering about
That way you only see the ECT(0) packets:
```
123-1234567:~ user$ tcpdump -i en4 -v -n 'ip and (ip[1] & 0x3) == 2' # Not-ECT
tcpdump: listening on en4, link-type EN10MB (Ethernet), capture size 262144 bytes
11:06:35.246869 IP (tos 0x2,ECT(0), ttl 127, id 12603, offset 0, flags [DF], proto TCP (6), length 88)
    172.16.16.40.443 > 192.168.250.102.49502: Flags [P.], cksum 0x2657 (correct), seq 768726506:768726542, ack 456334012, win 65528, options [nop,nop,TS val 268556192 ecr 3142990388], length 36
11:06:35.246991 IP (tos 0x2,ECT(0), ttl 127, id 12604, offset 0, flags [DF], proto TCP (6), length 1142)
    172.16.16.40.443 > 192.168.250.102.49502: Flags [P.], cksum 0xecae (correct), seq 36:1126, ack 1, win 65528, options [nop,nop,TS val 268556192 ecr 3142990388], length 1090
^C
2 packets captured
729954 packets received by filter
0 packets dropped by kernel
```

**Comment by lynxthecat** [comment]
I see many ECT(0) packets, but never any CE packets. Do you see those? How might I reliably try to test for those?

**Comment by moeller0** [comment]
I am at work right now with an ECN capable AQM, so I can not expect CE marks... I can retest at home, where my static cake shapers should generate plenty of CE packets during saturating loads. You also can look at the `tc -s qdisc` output, cake reports how many marks it applied, just look before and after a transfer test to check whether you can expect any marks at all or not...

**Comment by lynxthecat** [comment]
I do see some marks reported by `tc -s qdisc`:
```
qdisc cake 803f: dev wan root refcnt 2 bandwidth 20Mbit diffserv4 triple-isolate nat wash ack-filter split-gso rtt 100ms noatm overhead 0
 Sent 1488467472 bytes 12607629 pkt (dropped 434184, overlimits 4964470 requeues 0)
 backlog 0b 0p requeues 0
 memory used: 583848b of 4Mb
 capacity estimate: 20Mbit
 min/max network layer size:           28 /    1500
 min/max overhead-adjusted size:       28 /    1500
 average network hdr offset:           14

                   Bulk  Best Effort        Video        Voice
  thresh       1250Kbit       20Mbit       10Mbit        5Mbit
  target         14.5ms          5ms          5ms          5ms
  interval        110ms        100ms        100ms        100ms
  pk_delay         61us        1.7ms         17us         30us
  av_delay         20us        351us          0us         12us
  sp_delay         13us          9us          0us          5us
  backlog            0b           0b           0b           0b
  pkts            15277     12949528            9        76999
  bytes         1175106   1517606410         1062      9401622
  way_inds            0       582583            0         1546
  way_miss           26        15164            9         8896
  way_cols            0            0            0            0
  drops               0         1089            0            0
  marks               0          239            0            0
  ack_drop            0       433095            0            0
  sp_flows            1            3            1            2
  bk_flows            0            1            0            0
  un_flows            0            0            0            0
  max_len           411        52212          126         1374
  quantum           300          610          305          300
```

Now I just need to try to capture them with tcpdump.

**Comment by lynxthecat** [comment]
Does this simply mean that my ISP is stripping out the ECN bits in respect of ingress packets?

**Comment by moeller0** [comment]
Could be, but not necessarily... So on my linix box if I run a speedtest, I see plenty of CE marks on the router (in upload direction on pppoe-wan an in download direction on br-lan, exactly what I expect if my cake qdiscs are responsible for the marks), but I also see ECT(0) in both directions... But note my tcpdump filters seem to only catch IPv4 traffic...
Question: could you disable the copy egress DSCP to ingress traffic nft method you employ, just to rule out that in the DSCP copy nft also wipes the two ECN bits somehow?

**Comment by lynxthecat** [comment]
> Question: could you disable the copy egress DSCP to ingress traffic nft method you employ, just to rule out that in the DSCP copy nft also wipes the two ECN bits somehow?

I wondered about this too. But wouldn't it be possible to work this out from the data captured from my modem since that is upstream of my RT3200 with cake and the nftables stuff? Or is that still not conclusive? 

Looking at my data, the only way I can trigger CE marks is via upload to my OneDrive. What sort of internet activity on your connection triggers CE marks? For example I don't see it on speed tests. 

According to this reference:

> ECN uses the three - way handshake to determine whether or not a sender and receiver are ECN compatible. During the initial SYN ECN will set TCP header bits 8 ( CWR flag) and bit 9 (ECN -Echo flag), if the receiver of this SYN is ECN compatible it will reply back in its SYN | ACK by setting TCP header bit 9. If the receiver is NOT compatible, the receiver will reply back by not setting any TCP header reserve bits. If this initialization is successful then the ECT flag will be set in all packets thereafter (except pure ACK's).

https://community.broadcom.com/symantecenterprise/communities/community-home/librarydocuments/viewdocument?DocumentKey=879fa8ce-7aa3-43fd-8c22-4f6e0b2897db&CommunityKey=1ecf5f55-9545-44d6-b0f4-4e4a7f5f5e68&tab=librarydocuments#:~:text=ECN%20uses%20the%20three%20%2D%20way,setting%20TCP%20header%20bit%209.

I just sent you another data capture and using this filter:

(ip.src==13.107.136.8 || ip.dst_host==13.107.136.8) && ((tcp.seq == 1 && tcp.ack == 1&&tcp.len==0 && !tcp.flags.fin == 1)||tcp.flags.syn==1)

I see a three-way handshake:

```
33788	33.005331	XX.XX.XX.XX	13.107.136.8	TCP	52	53921 → 443 [SYN, ECE, CWR] Seq=0 Win=64240 Len=0 MSS=1460 WS=256 SACK_PERM
33797	33.043926	13.107.136.8	XX.XX.XX.XX	TCP	52	443 → 53921 [SYN, ACK, ECE] Seq=0 Ack=1 Win=65535 Len=0 MSS=1320 WS=256 SACK_PERM
33798	33.046003	XX.XX.XX.XX	13.107.136.8	TCP	40	53921 → 443 [ACK] Seq=1 Ack=1 Win=131840 Len=0
```

That seems to cover both upload (where CE marks are applied) and download (where CE marks are not applied).

Now in respect of upload 'application data' packets, I see ECN: ECT(0), but in respect of download 'application data' I see rather: ECN: Not-ECT and DSCP AF11. 

So I'm wondering if we can deduce from this that my ISP is setting DSCP to AF11 and in so doing also bleaching the two ECN bits?

**Comment by moeller0** [comment]
> But wouldn't it be possible to work out whether my ISP is bleaching ECN using the data captured from my modem since that is upstream of my RT3200 with cake and the nftables stuff? Or is that still not conclusive?

Probably, it is just simpler to rule interferences out by simply disabling all potential sources (it would also IMHO be a good opportunity to confirm that the nft code does, as I expect, the right thing regarding the ECN bits, namely conserving them when changing the DSCP).



> Looking at my data, the only way I can trigger CE marks is via upload to my OneDrive. What sort of internet activity on your connection triggers CE marks? For example I don't see it on speed tests.

So, I use flent to run an 8-flows per direction bidirectional speed-test for >= 60 seconds, then I tend to see CE marks in both directions (when looking at the appreciate places, wan for egress, br-lan for ingress so that my cake shaper had a chance to actually set CE). I note that doing this from macos is a hit and miss game, apple does weird things with ECN (complicated heuristics when to use and when not to use) but from my Linux host I see CE marks pretty reliably.

> I see a three-way handshake:

Not a bad approach, however you will only see this for connections that are established during the capture time, while ECT(0)/ECT(1)/CE should be visible at all times. I guess it might be worth looking at TCP's ECE and CWR bits to chech whether ECN is operational.



> So I'm wondering if we can deduce from this that my ISP is setting DSCP to AF11 and in so doing also bleaching the two ECN bits? Or is this inconclusive?

This is not impossible, say if they use gear that still operates on the old 8bit TOS field, that was later separated into the 6bit DSCP field and the 2 bit ECN field. ECN's roll-out has been bedeviled by this problem since ECN's inception... I respectfully offer the opinion that the selected approach of simply redefining these 8 bits without adding a marker bit how to interpret these properly (so old style TOS usage could be detected) was way too optimistic, but I guess that is easy to say in hindsight, and it is not that I have such an indicator bit candidate in the IPv4/6 header I could recommend.

**Comment by moeller0** [comment]
BTW, here are my tcpdump invocations to capture ECN related IP packets for both IPv4 and IPv6:
```
# ECN: IPv4
tcpdump -i pppoe-wan -v -n 'ip and (ip[1] & 0x3) != 0' # NOT Not-ECT
tcpdump -i pppoe-wan -v -n 'ip and (ip[1] & 0x3) == 0' # Not-ECT
tcpdump -i pppoe-wan -v -n 'ip and (ip[1] & 0x3) == 1' # ECT(1)
tcpdump -i pppoe-wan -v -n 'ip and (ip[1] & 0x3) == 2' # ECT(0)
tcpdump -i pppoe-wan -v -n 'ip and (ip[1] & 0x3) == 3' # CE


# ECN: IPv6
tcpdump -i pppoe-wan -v -n 'ip6 and (ip6[0:2] & 0x30) >> 4  != 0' # NOT Not-ECT
tcpdump -i pppoe-wan -v -n 'ip6 and (ip6[0:2] & 0x30) >> 4  == 0' # Not-ECT
tcpdump -i pppoe-wan -v -n 'ip6 and (ip6[0:2] & 0x30) >> 4  == 1' # ECT(1)
tcpdump -i pppoe-wan -v -n 'ip6 and (ip6[0:2] & 0x30) >> 4  == 2' # ECT(0)
tcpdump -i pppoe-wan -v -n 'ip6 and (ip6[0:2] & 0x30) >> 4  == 3' # CE
```

Note that for IPv4 both tcpdump and wireshark report this as ECN value (e.g. `ip.dsfield.ecn!=0`), while for IPv6 this is reported as value for traffic class in tcpdump, while wireshark reports the ECN value, but filters on e.g. `!(ipv6.tclass == 0x02)` not sure this actually works as intenden when dscps are used and hence the tclass woould need to be masked...

**Comment by lynxthecat** [comment]
I tried disabling the saving of DSCPs to conntrack using nftables and the restoring of DSCPs from conntrack using tc, but the situation remained the same - I never see ECN bits set in any download packets. I haven't entirely ruled out that windows might not be playing ball, but this paper: 

https://ozgualaycom.files.wordpress.com/2018/05/ecn_commag_2018.pdf

seems to suggest that most mobile operators (including mine) bleach ECNs at the first hop. 

If cake marks packets with CE rather than drop them,  what happens if the ECN functionality is broken because of bleaching? Will cake then switch to drops or will it keep just marking? 

If an ISP bleaches the ECN bits I believe cake won't mark download packets because the ECT(0) or ECT(1) ECN capability flags will also get wiped, but cake will mark upload packets because those flags are generated by outgoing packets before the bleaching.

**Comment by moeller0** [comment]
> I tried disabling both the saving of DSCPs to conntrack using nftables and also the restoring of DSCPs from conntrack using tc, but the situation remained the same - I never see ECN bits set in any download packets. I haven't entirely ruled out that Windows might not be playing ball with having enabled ECN, but this paper:

Mmmh, that is not a sign of competence for vodafone... but smeels like something mobile carriers would do....



> If an ISP bleaches the ECN bits, I think cake won't mark download packets because the ECT(0) or ECT(1) ECN capability flags will also get wiped, but cake will mark upload packets because those ECN capability flags are generated locally in the outgoing packets before the bleaching occurs.

Yes, if decided to take action on a packet all that cake checks is whether the IP packet carries an non-zero ECN bitfield, in which case it will CE mark the packet otherwise it will drop the packet. So if ECT(0)/ECT(1) are bleached cake will not mark it. However the TCP stack should detect the lack of ECT(0) or ECT(1) packets coming in an stop using ECN on such a connection...



> Which leads me to the question: if cake marks packets with CE rather than dropping them, what happens if the ECN functionality is actually broken because of bleaching? Will cake work out that the marking isn't working and switch from marking to dropping packets?

No, cake will not do anything special, but if that flow keeps ignoring the CE marks and will continually queue excessive number of packets in cake, the BLUE component will ramp up and that will cause drops independent of the ECN bits (exactly to rule in misbehaving flows with broken ECN).



> If it's true that my ISP bleaches ECNs then presumably I should also locally bleach outgoing packets to ensure cake doesn't try to rely on ECN marking for upload when it'll have no effect?

In that case it makes sense to disable ECN in the endpoints. Cake does not offer a toggle to ignore ECN bits yet, that is something I thought useful for some time, but this faces a "round tuit" problem and without a case to demonstrate how such an option would be useful it will be hard to convince the kernel crowd to add such an option I guess.

**Comment by lynxthecat** [comment]
I found a way to locally bleach the ECN bits on upload packets before cake sees them - see here:

https://github.com/lynxthecat/cake-qos-simple/commit/86ac3cc31ab298613fb243fea0260483df4fa254
